{
  "tableName": "Automates",
  "rowCount": 5,
  "columns": [
    {
      "name": "ID",
      "type": "INTEGER",
      "notNull": false,
      "defaultValue": null,
      "primaryKey": true,
      "position": 0
    },
    {
      "name": "Type",
      "type": "TEXT",
      "notNull": false,
      "defaultValue": null,
      "primaryKey": false,
      "position": 1
    },
    {
      "name": "Description",
      "type": "TEXT",
      "notNull": false,
      "defaultValue": null,
      "primaryKey": false,
      "position": 2
    },
    {
      "name": "Help",
      "type": "TEXT",
      "notNull": false,
      "defaultValue": null,
      "primaryKey": false,
      "position": 3
    },
    {
      "name": "DisabledHelp",
      "type": "TEXT",
      "notNull": false,
      "defaultValue": null,
      "primaryKey": false,
      "position": 4
    },
    {
      "name": "HotKey",
      "type": "TEXT",
      "notNull": false,
      "defaultValue": null,
      "primaryKey": false,
      "position": 5
    },
    {
      "name": "HotKeyAlt",
      "type": "TEXT",
      "notNull": false,
      "defaultValue": null,
      "primaryKey": false,
      "position": 6
    },
    {
      "name": "HotKeyPriority",
      "type": "INTEGER",
      "notNull": false,
      "defaultValue": "0",
      "primaryKey": false,
      "position": 7
    },
    {
      "name": "HotKeyPriorityAlt",
      "type": "INTEGER",
      "notNull": false,
      "defaultValue": "0",
      "primaryKey": false,
      "position": 8
    },
    {
      "name": "OrderPriority",
      "type": "INTEGER",
      "notNull": false,
      "defaultValue": "0",
      "primaryKey": false,
      "position": 9
    },
    {
      "name": "AltDown",
      "type": "boolean",
      "notNull": false,
      "defaultValue": "0",
      "primaryKey": false,
      "position": 10
    },
    {
      "name": "AltDownAlt",
      "type": "boolean",
      "notNull": false,
      "defaultValue": "0",
      "primaryKey": false,
      "position": 11
    },
    {
      "name": "ShiftDown",
      "type": "boolean",
      "notNull": false,
      "defaultValue": "0",
      "primaryKey": false,
      "position": 12
    },
    {
      "name": "ShiftDownAlt",
      "type": "boolean",
      "notNull": false,
      "defaultValue": "0",
      "primaryKey": false,
      "position": 13
    },
    {
      "name": "CtrlDown",
      "type": "boolean",
      "notNull": false,
      "defaultValue": "0",
      "primaryKey": false,
      "position": 14
    },
    {
      "name": "CtrlDownAlt",
      "type": "boolean",
      "notNull": false,
      "defaultValue": "0",
      "primaryKey": false,
      "position": 15
    },
    {
      "name": "Visible",
      "type": "boolean",
      "notNull": false,
      "defaultValue": "0",
      "primaryKey": false,
      "position": 16
    },
    {
      "name": "ConfirmCommand",
      "type": "boolean",
      "notNull": false,
      "defaultValue": "0",
      "primaryKey": false,
      "position": 17
    },
    {
      "name": "Automate",
      "type": "TEXT",
      "notNull": false,
      "defaultValue": null,
      "primaryKey": false,
      "position": 18
    },
    {
      "name": "Command",
      "type": "TEXT",
      "notNull": false,
      "defaultValue": null,
      "primaryKey": false,
      "position": 19
    },
    {
      "name": "IconIndex",
      "type": "INTEGER",
      "notNull": false,
      "defaultValue": "'-1'",
      "primaryKey": false,
      "position": 20
    },
    {
      "name": "IconAtlas",
      "type": "TEXT",
      "notNull": false,
      "defaultValue": "NULL",
      "primaryKey": false,
      "position": 21
    }
  ],
  "primaryKeys": [
    "ID"
  ],
  "foreignKeys": [
    {
      "column": "IconAtlas",
      "referencedTable": "IconTextureAtlases",
      "referencedColumn": "Atlas",
      "onUpdate": "NO ACTION",
      "onDelete": "NO ACTION"
    }
  ],
  "indexes": [],
  "createStatement": "CREATE TABLE Automates ('ID' integer primary key autoincrement , 'Type' text , 'Description' text , 'Help' text , 'DisabledHelp' text , 'HotKey' text , 'HotKeyAlt' text , 'HotKeyPriority' integer default 0 , 'HotKeyPriorityAlt' integer default 0 , 'OrderPriority' integer default 0 , 'AltDown' boolean default 0 , 'AltDownAlt' boolean default 0 , 'ShiftDown' boolean default 0 , 'ShiftDownAlt' boolean default 0 , 'CtrlDown' boolean default 0 , 'CtrlDownAlt' boolean default 0 , 'Visible' boolean default 0 , 'ConfirmCommand' boolean default 0 , 'Automate' text , 'Command' text , 'IconIndex' integer default '-1' , 'IconAtlas' text default NULL , foreign key (IconAtlas) references IconTextureAtlases(Atlas))",
  "metadata": {
    "exportDate": "2025-09-01T02:32:22.974Z"
  }
}