{
  "tableName": "Contracts",
  "rowCount": 0,
  "columns": [
    {
      "name": "ID",
      "type": "INTEGER",
      "notNull": false,
      "defaultValue": null,
      "primaryKey": true,
      "position": 0
    },
    {
      "name": "Type",
      "type": "TEXT",
      "notNull": true,
      "defaultValue": null,
      "primaryKey": false,
      "position": 1
    },
    {
      "name": "Description",
      "type": "TEXT",
      "notNull": false,
      "defaultValue": null,
      "primaryKey": false,
      "position": 2
    },
    {
      "name": "Help",
      "type": "TEXT",
      "notNull": false,
      "defaultValue": null,
      "primaryKey": false,
      "position": 3
    },
    {
      "name": "Adjective",
      "type": "TEXT",
      "notNull": false,
      "defaultValue": null,
      "primaryKey": false,
      "position": 4
    },
    {
      "name": "Civilopedia",
      "type": "TEXT",
      "notNull": false,
      "defaultValue": null,
      "primaryKey": false,
      "position": 5
    },
    {
      "name": "Category",
      "type": "TEXT",
      "notNull": false,
      "defaultValue": null,
      "primaryKey": false,
      "position": 6
    },
    {
      "name": "IconAtlas",
      "type": "TEXT",
      "notNull": false,
      "defaultValue": null,
      "primaryKey": false,
      "position": 7
    },
    {
      "name": "PortraitIndex",
      "type": "INTEGER",
      "notNull": false,
      "defaultValue": "'-1'",
      "primaryKey": false,
      "position": 8
    },
    {
      "name": "PurchaseDing",
      "type": "TEXT",
      "notNull": false,
      "defaultValue": "'AS2D_INTERFACE_CITY_SCREEN_PURCHASE'",
      "primaryKey": false,
      "position": 9
    },
    {
      "name": "PrereqEra",
      "type": "TEXT",
      "notNull": false,
      "defaultValue": "'ERA_ANCIENT'",
      "primaryKey": false,
      "position": 10
    },
    {
      "name": "ObsoleteEra",
      "type": "TEXT",
      "notNull": false,
      "defaultValue": null,
      "primaryKey": false,
      "position": 11
    },
    {
      "name": "PrereqReligion",
      "type": "TEXT",
      "notNull": false,
      "defaultValue": null,
      "primaryKey": false,
      "position": 12
    },
    {
      "name": "PrereqCiv",
      "type": "TEXT",
      "notNull": false,
      "defaultValue": null,
      "primaryKey": false,
      "position": 13
    },
    {
      "name": "PolicyType",
      "type": "TEXT",
      "notNull": false,
      "defaultValue": null,
      "primaryKey": false,
      "position": 14
    },
    {
      "name": "PromotionType",
      "type": "TEXT",
      "notNull": false,
      "defaultValue": null,
      "primaryKey": false,
      "position": 15
    },
    {
      "name": "IsHolyOrder",
      "type": "boolean",
      "notNull": false,
      "defaultValue": "0",
      "primaryKey": false,
      "position": 16
    },
    {
      "name": "IsSlavery",
      "type": "boolean",
      "notNull": false,
      "defaultValue": "0",
      "primaryKey": false,
      "position": 17
    },
    {
      "name": "PrereqPietyLevel",
      "type": "TEXT",
      "notNull": false,
      "defaultValue": null,
      "primaryKey": false,
      "position": 18
    },
    {
      "name": "Maintenance",
      "type": "INTEGER",
      "notNull": false,
      "defaultValue": "0",
      "primaryKey": false,
      "position": 19
    },
    {
      "name": "Rating",
      "type": "INTEGER",
      "notNull": false,
      "defaultValue": "0",
      "primaryKey": false,
      "position": 20
    },
    {
      "name": "DisbandChance",
      "type": "INTEGER",
      "notNull": false,
      "defaultValue": "0",
      "primaryKey": false,
      "position": 21
    },
    {
      "name": "MutinyChance",
      "type": "INTEGER",
      "notNull": false,
      "defaultValue": "0",
      "primaryKey": false,
      "position": 22
    },
    {
      "name": "ContractTurns",
      "type": "INTEGER",
      "notNull": false,
      "defaultValue": "0",
      "primaryKey": false,
      "position": 23
    }
  ],
  "primaryKeys": [
    "ID"
  ],
  "foreignKeys": [
    {
      "column": "PromotionType",
      "referencedTable": "UnitPromotions",
      "referencedColumn": "Type",
      "onUpdate": "NO ACTION",
      "onDelete": "NO ACTION"
    },
    {
      "column": "PolicyType",
      "referencedTable": "Policies",
      "referencedColumn": "Type",
      "onUpdate": "NO ACTION",
      "onDelete": "NO ACTION"
    },
    {
      "column": "PrereqCiv",
      "referencedTable": "Civilizations",
      "referencedColumn": "Type",
      "onUpdate": "NO ACTION",
      "onDelete": "NO ACTION"
    },
    {
      "column": "PrereqReligion",
      "referencedTable": "Religions",
      "referencedColumn": "Type",
      "onUpdate": "NO ACTION",
      "onDelete": "NO ACTION"
    },
    {
      "column": "ObsoleteEra",
      "referencedTable": "Eras",
      "referencedColumn": "Type",
      "onUpdate": "NO ACTION",
      "onDelete": "NO ACTION"
    },
    {
      "column": "PrereqEra",
      "referencedTable": "Eras",
      "referencedColumn": "Type",
      "onUpdate": "NO ACTION",
      "onDelete": "NO ACTION"
    },
    {
      "column": "IconAtlas",
      "referencedTable": "IconTextureAtlases",
      "referencedColumn": "Atlas",
      "onUpdate": "NO ACTION",
      "onDelete": "NO ACTION"
    },
    {
      "column": "Category",
      "referencedTable": "Language_en_US",
      "referencedColumn": "Tag",
      "onUpdate": "NO ACTION",
      "onDelete": "NO ACTION"
    },
    {
      "column": "Civilopedia",
      "referencedTable": "Language_en_US",
      "referencedColumn": "Tag",
      "onUpdate": "NO ACTION",
      "onDelete": "NO ACTION"
    },
    {
      "column": "Adjective",
      "referencedTable": "Language_en_US",
      "referencedColumn": "Tag",
      "onUpdate": "NO ACTION",
      "onDelete": "NO ACTION"
    },
    {
      "column": "Help",
      "referencedTable": "Language_en_US",
      "referencedColumn": "Tag",
      "onUpdate": "NO ACTION",
      "onDelete": "NO ACTION"
    },
    {
      "column": "Description",
      "referencedTable": "Language_en_US",
      "referencedColumn": "Tag",
      "onUpdate": "NO ACTION",
      "onDelete": "NO ACTION"
    }
  ],
  "indexes": [
    {
      "name": "sqlite_autoindex_Contracts_1",
      "unique": true,
      "partial": false
    }
  ],
  "createStatement": "CREATE TABLE Contracts ('ID' integer primary key , 'Type' text  not null unique , 'Description' text , 'Help' text , 'Adjective' text , 'Civilopedia' text , 'Category' text , 'IconAtlas' text , 'PortraitIndex' integer default '-1' , 'PurchaseDing' text default 'AS2D_INTERFACE_CITY_SCREEN_PURCHASE' , 'PrereqEra' text default 'ERA_ANCIENT' , 'ObsoleteEra' text , 'PrereqReligion' text , 'PrereqCiv' text , 'PolicyType' text , 'PromotionType' text , 'IsHolyOrder' boolean default 0 , 'IsSlavery' boolean default 0 , 'PrereqPietyLevel' text , 'Maintenance' integer default 0 , 'Rating' integer default 0 , 'DisbandChance' integer default 0 , 'MutinyChance' integer default 0 , 'ContractTurns' integer default 0 , foreign key (Description) references Language_en_US(Tag), foreign key (Help) references Language_en_US(Tag), foreign key (Adjective) references Language_en_US(Tag), foreign key (Civilopedia) references Language_en_US(Tag), foreign key (Category) references Language_en_US(Tag), foreign key (IconAtlas) references IconTextureAtlases(Atlas), foreign key (PrereqEra) references Eras(Type), foreign key (ObsoleteEra) references Eras(Type), foreign key (PrereqReligion) references Religions(Type), foreign key (PrereqCiv) references Civilizations(Type), foreign key (PolicyType) references Policies(Type), foreign key (PromotionType) references UnitPromotions(Type))",
  "metadata": {
    "exportDate": "2025-09-01T02:32:23.156Z"
  }
}