{
  "tableName": "Corporations",
  "rowCount": 0,
  "columns": [
    {
      "name": "ID",
      "type": "INTEGER",
      "notNull": false,
      "defaultValue": null,
      "primaryKey": true,
      "position": 0
    },
    {
      "name": "Type",
      "type": "TEXT",
      "notNull": true,
      "defaultValue": null,
      "primaryKey": false,
      "position": 1
    },
    {
      "name": "Description",
      "type": "TEXT",
      "notNull": false,
      "defaultValue": null,
      "primaryKey": false,
      "position": 2
    },
    {
      "name": "Help",
      "type": "TEXT",
      "notNull": false,
      "defaultValue": null,
      "primaryKey": false,
      "position": 3
    },
    {
      "name": "ResourceBonusHelp",
      "type": "TEXT",
      "notNull": false,
      "defaultValue": null,
      "primaryKey": false,
      "position": 4
    },
    {
      "name": "OfficeBonusHelp",
      "type": "TEXT",
      "notNull": false,
      "defaultValue": null,
      "primaryKey": false,
      "position": 5
    },
    {
      "name": "TradeRouteBonusHelp",
      "type": "TEXT",
      "notNull": false,
      "defaultValue": null,
      "primaryKey": false,
      "position": 6
    },
    {
      "name": "OfficeBenefitHelper",
      "type": "TEXT",
      "notNull": false,
      "defaultValue": null,
      "primaryKey": false,
      "position": 7
    },
    {
      "name": "HeadquartersBuildingClass",
      "type": "TEXT",
      "notNull": false,
      "defaultValue": null,
      "primaryKey": false,
      "position": 8
    },
    {
      "name": "OfficeBuildingClass",
      "type": "TEXT",
      "notNull": false,
      "defaultValue": null,
      "primaryKey": false,
      "position": 9
    },
    {
      "name": "FranchiseBuildingClass",
      "type": "TEXT",
      "notNull": false,
      "defaultValue": null,
      "primaryKey": false,
      "position": 10
    },
    {
      "name": "BaseFranchises",
      "type": "INTEGER",
      "notNull": false,
      "defaultValue": "0",
      "primaryKey": false,
      "position": 11
    },
    {
      "name": "NumFreeTradeRoutes",
      "type": "INTEGER",
      "notNull": false,
      "defaultValue": "0",
      "primaryKey": false,
      "position": 12
    },
    {
      "name": "TradeRouteRecipientBonus",
      "type": "INTEGER",
      "notNull": false,
      "defaultValue": "0",
      "primaryKey": false,
      "position": 13
    },
    {
      "name": "TradeRouteTargetBonus",
      "type": "INTEGER",
      "notNull": false,
      "defaultValue": "0",
      "primaryKey": false,
      "position": 14
    },
    {
      "name": "TradeRouteLandDistanceModifier",
      "type": "INTEGER",
      "notNull": false,
      "defaultValue": "0",
      "primaryKey": false,
      "position": 15
    },
    {
      "name": "TradeRouteSeaDistanceModifier",
      "type": "INTEGER",
      "notNull": false,
      "defaultValue": "0",
      "primaryKey": false,
      "position": 16
    },
    {
      "name": "TradeRouteSpeedModifier",
      "type": "INTEGER",
      "notNull": false,
      "defaultValue": "100",
      "primaryKey": false,
      "position": 17
    },
    {
      "name": "TradeRoutesInvulnerable",
      "type": "boolean",
      "notNull": false,
      "defaultValue": "0",
      "primaryKey": false,
      "position": 18
    },
    {
      "name": "TradeRouteVisionBoost",
      "type": "INTEGER",
      "notNull": false,
      "defaultValue": "0",
      "primaryKey": false,
      "position": 19
    },
    {
      "name": "RandomSpreadChance",
      "type": "INTEGER",
      "notNull": false,
      "defaultValue": "0",
      "primaryKey": false,
      "position": 20
    },
    {
      "name": "TourismModNumFranchises",
      "type": "INTEGER",
      "notNull": false,
      "defaultValue": "0",
      "primaryKey": false,
      "position": 21
    },
    {
      "name": "PortraitIndex",
      "type": "INTEGER",
      "notNull": false,
      "defaultValue": "'-1'",
      "primaryKey": false,
      "position": 22
    },
    {
      "name": "IconAtlas",
      "type": "TEXT",
      "notNull": false,
      "defaultValue": null,
      "primaryKey": false,
      "position": 23
    }
  ],
  "primaryKeys": [
    "ID"
  ],
  "foreignKeys": [
    {
      "column": "IconAtlas",
      "referencedTable": "IconTextureAtlases",
      "referencedColumn": "Atlas",
      "onUpdate": "NO ACTION",
      "onDelete": "NO ACTION"
    },
    {
      "column": "FranchiseBuildingClass",
      "referencedTable": "BuildingClasses",
      "referencedColumn": "Type",
      "onUpdate": "NO ACTION",
      "onDelete": "NO ACTION"
    },
    {
      "column": "OfficeBuildingClass",
      "referencedTable": "BuildingClasses",
      "referencedColumn": "Type",
      "onUpdate": "NO ACTION",
      "onDelete": "NO ACTION"
    },
    {
      "column": "HeadquartersBuildingClass",
      "referencedTable": "BuildingClasses",
      "referencedColumn": "Type",
      "onUpdate": "NO ACTION",
      "onDelete": "NO ACTION"
    },
    {
      "column": "OfficeBenefitHelper",
      "referencedTable": "Language_en_US",
      "referencedColumn": "Tag",
      "onUpdate": "NO ACTION",
      "onDelete": "NO ACTION"
    },
    {
      "column": "TradeRouteBonusHelp",
      "referencedTable": "Language_en_US",
      "referencedColumn": "Tag",
      "onUpdate": "NO ACTION",
      "onDelete": "NO ACTION"
    },
    {
      "column": "OfficeBonusHelp",
      "referencedTable": "Language_en_US",
      "referencedColumn": "Tag",
      "onUpdate": "NO ACTION",
      "onDelete": "NO ACTION"
    },
    {
      "column": "ResourceBonusHelp",
      "referencedTable": "Language_en_US",
      "referencedColumn": "Tag",
      "onUpdate": "NO ACTION",
      "onDelete": "NO ACTION"
    },
    {
      "column": "Help",
      "referencedTable": "Language_en_US",
      "referencedColumn": "Tag",
      "onUpdate": "NO ACTION",
      "onDelete": "NO ACTION"
    },
    {
      "column": "Description",
      "referencedTable": "Language_en_US",
      "referencedColumn": "Tag",
      "onUpdate": "NO ACTION",
      "onDelete": "NO ACTION"
    }
  ],
  "indexes": [
    {
      "name": "sqlite_autoindex_Corporations_1",
      "unique": true,
      "partial": false
    }
  ],
  "createStatement": "CREATE TABLE Corporations ('ID' integer primary key , 'Type' text  not null unique , 'Description' text , 'Help' text , 'ResourceBonusHelp' text , 'OfficeBonusHelp' text , 'TradeRouteBonusHelp' text , 'OfficeBenefitHelper' text , 'HeadquartersBuildingClass' text , 'OfficeBuildingClass' text , 'FranchiseBuildingClass' text , 'BaseFranchises' integer default 0 , 'NumFreeTradeRoutes' integer default 0 , 'TradeRouteRecipientBonus' integer default 0 , 'TradeRouteTargetBonus' integer default 0 , 'TradeRouteLandDistanceModifier' integer default 0 , 'TradeRouteSeaDistanceModifier' integer default 0 , 'TradeRouteSpeedModifier' integer default 100 , 'TradeRoutesInvulnerable' boolean default 0 , 'TradeRouteVisionBoost' integer default 0 , 'RandomSpreadChance' integer default 0 , 'TourismModNumFranchises' integer default 0 , 'PortraitIndex' integer default '-1' , 'IconAtlas' text , foreign key (Description) references Language_en_US(Tag), foreign key (Help) references Language_en_US(Tag), foreign key (ResourceBonusHelp) references Language_en_US(Tag), foreign key (OfficeBonusHelp) references Language_en_US(Tag), foreign key (TradeRouteBonusHelp) references Language_en_US(Tag), foreign key (OfficeBenefitHelper) references Language_en_US(Tag), foreign key (HeadquartersBuildingClass) references BuildingClasses(Type), foreign key (OfficeBuildingClass) references BuildingClasses(Type), foreign key (FranchiseBuildingClass) references BuildingClasses(Type), foreign key (IconAtlas) references IconTextureAtlases(Atlas))",
  "metadata": {
    "exportDate": "2025-09-01T02:32:23.165Z"
  }
}