{
  "tableName": "Events",
  "rowCount": 0,
  "columns": [
    {
      "name": "ID",
      "type": "INTEGER",
      "notNull": false,
      "defaultValue": null,
      "primaryKey": true,
      "position": 0
    },
    {
      "name": "Type",
      "type": "TEXT",
      "notNull": true,
      "defaultValue": null,
      "primaryKey": false,
      "position": 1
    },
    {
      "name": "EventClass",
      "type": "TEXT",
      "notNull": false,
      "defaultValue": null,
      "primaryKey": false,
      "position": 2
    },
    {
      "name": "Description",
      "type": "TEXT",
      "notNull": false,
      "defaultValue": null,
      "primaryKey": false,
      "position": 3
    },
    {
      "name": "Help",
      "type": "TEXT",
      "notNull": false,
      "defaultValue": null,
      "primaryKey": false,
      "position": 4
    },
    {
      "name": "Effect",
      "type": "TEXT",
      "notNull": false,
      "defaultValue": null,
      "primaryKey": false,
      "position": 5
    },
    {
      "name": "EventArt",
      "type": "TEXT",
      "notNull": false,
      "defaultValue": null,
      "primaryKey": false,
      "position": 6
    },
    {
      "name": "EventAudio",
      "type": "TEXT",
      "notNull": false,
      "defaultValue": null,
      "primaryKey": false,
      "position": 7
    },
    {
      "name": "RandomChance",
      "type": "INTEGER",
      "notNull": false,
      "defaultValue": "0",
      "primaryKey": false,
      "position": 8
    },
    {
      "name": "RandomChanceDelta",
      "type": "INTEGER",
      "notNull": false,
      "defaultValue": "0",
      "primaryKey": false,
      "position": 9
    },
    {
      "name": "IsOneShot",
      "type": "boolean",
      "notNull": false,
      "defaultValue": "0",
      "primaryKey": false,
      "position": 10
    },
    {
      "name": "Global",
      "type": "boolean",
      "notNull": false,
      "defaultValue": "0",
      "primaryKey": false,
      "position": 11
    },
    {
      "name": "EraScaling",
      "type": "boolean",
      "notNull": false,
      "defaultValue": "0",
      "primaryKey": false,
      "position": 12
    },
    {
      "name": "EventCooldown",
      "type": "INTEGER",
      "notNull": false,
      "defaultValue": "30",
      "primaryKey": false,
      "position": 13
    },
    {
      "name": "NumChoices",
      "type": "INTEGER",
      "notNull": false,
      "defaultValue": "1",
      "primaryKey": false,
      "position": 14
    },
    {
      "name": "IgnoresGlobalCooldown",
      "type": "boolean",
      "notNull": false,
      "defaultValue": "0",
      "primaryKey": false,
      "position": 15
    },
    {
      "name": "MinimumNationalPopulation",
      "type": "INTEGER",
      "notNull": false,
      "defaultValue": "0",
      "primaryKey": false,
      "position": 16
    },
    {
      "name": "MinimumNumberCities",
      "type": "INTEGER",
      "notNull": false,
      "defaultValue": "0",
      "primaryKey": false,
      "position": 17
    },
    {
      "name": "RequiredCiv",
      "type": "TEXT",
      "notNull": false,
      "defaultValue": null,
      "primaryKey": false,
      "position": 18
    },
    {
      "name": "RequiredEra",
      "type": "TEXT",
      "notNull": false,
      "defaultValue": null,
      "primaryKey": false,
      "position": 19
    },
    {
      "name": "HasMetAMajorCiv",
      "type": "boolean",
      "notNull": false,
      "defaultValue": "0",
      "primaryKey": false,
      "position": 20
    },
    {
      "name": "InDebt",
      "type": "boolean",
      "notNull": false,
      "defaultValue": "0",
      "primaryKey": false,
      "position": 21
    },
    {
      "name": "LosingMoney",
      "type": "boolean",
      "notNull": false,
      "defaultValue": "0",
      "primaryKey": false,
      "position": 22
    },
    {
      "name": "MinimumNumCoastalCities",
      "type": "INTEGER",
      "notNull": false,
      "defaultValue": "0",
      "primaryKey": false,
      "position": 23
    },
    {
      "name": "LessThanMaximumTradeRoutes",
      "type": "boolean",
      "notNull": false,
      "defaultValue": "0",
      "primaryKey": false,
      "position": 24
    },
    {
      "name": "IsUnhappy",
      "type": "boolean",
      "notNull": false,
      "defaultValue": "0",
      "primaryKey": false,
      "position": 25
    },
    {
      "name": "IsSuperUnhappy",
      "type": "boolean",
      "notNull": false,
      "defaultValue": "0",
      "primaryKey": false,
      "position": 26
    },
    {
      "name": "ObsoleteEra",
      "type": "TEXT",
      "notNull": false,
      "defaultValue": null,
      "primaryKey": false,
      "position": 27
    },
    {
      "name": "ImprovementAnywhereRequired",
      "type": "TEXT",
      "notNull": false,
      "defaultValue": null,
      "primaryKey": false,
      "position": 28
    },
    {
      "name": "RequiredPolicy",
      "type": "TEXT",
      "notNull": false,
      "defaultValue": null,
      "primaryKey": false,
      "position": 29
    },
    {
      "name": "RequiredIdeology",
      "type": "TEXT",
      "notNull": false,
      "defaultValue": null,
      "primaryKey": false,
      "position": 30
    },
    {
      "name": "UnitClassRequired",
      "type": "TEXT",
      "notNull": false,
      "defaultValue": null,
      "primaryKey": false,
      "position": 31
    },
    {
      "name": "PrereqTech",
      "type": "TEXT",
      "notNull": false,
      "defaultValue": null,
      "primaryKey": false,
      "position": 32
    },
    {
      "name": "ObsoleteTech",
      "type": "TEXT",
      "notNull": false,
      "defaultValue": null,
      "primaryKey": false,
      "position": 33
    },
    {
      "name": "RequiresPantheon",
      "type": "boolean",
      "notNull": false,
      "defaultValue": "0",
      "primaryKey": false,
      "position": 34
    },
    {
      "name": "RequiredReligion",
      "type": "TEXT",
      "notNull": false,
      "defaultValue": null,
      "primaryKey": false,
      "position": 35
    },
    {
      "name": "RequiredStateReligion",
      "type": "TEXT",
      "notNull": false,
      "defaultValue": null,
      "primaryKey": false,
      "position": 36
    },
    {
      "name": "RequiresAnyStateReligion",
      "type": "boolean",
      "notNull": false,
      "defaultValue": "0",
      "primaryKey": false,
      "position": 37
    },
    {
      "name": "RequiredAnywhereBuildingClass",
      "type": "TEXT",
      "notNull": false,
      "defaultValue": null,
      "primaryKey": false,
      "position": 38
    },
    {
      "name": "RequiredNowhereBuildingClass",
      "type": "TEXT",
      "notNull": false,
      "defaultValue": null,
      "primaryKey": false,
      "position": 39
    },
    {
      "name": "RequiresHolyCity",
      "type": "boolean",
      "notNull": false,
      "defaultValue": "0",
      "primaryKey": false,
      "position": 40
    },
    {
      "name": "RequiresIdeology",
      "type": "boolean",
      "notNull": false,
      "defaultValue": "0",
      "primaryKey": false,
      "position": 41
    },
    {
      "name": "RequiresWar",
      "type": "boolean",
      "notNull": false,
      "defaultValue": "0",
      "primaryKey": false,
      "position": 42
    },
    {
      "name": "RequiresWarMinor",
      "type": "boolean",
      "notNull": false,
      "defaultValue": "0",
      "primaryKey": false,
      "position": 43
    },
    {
      "name": "IsVassalOfSomeone",
      "type": "boolean",
      "notNull": false,
      "defaultValue": "0",
      "primaryKey": false,
      "position": 44
    },
    {
      "name": "IsMasterOfSomeone",
      "type": "boolean",
      "notNull": false,
      "defaultValue": "0",
      "primaryKey": false,
      "position": 45
    }
  ],
  "primaryKeys": [
    "ID"
  ],
  "foreignKeys": [
    {
      "column": "RequiredNowhereBuildingClass",
      "referencedTable": "BuildingClasses",
      "referencedColumn": "Type",
      "onUpdate": "NO ACTION",
      "onDelete": "NO ACTION"
    },
    {
      "column": "RequiredAnywhereBuildingClass",
      "referencedTable": "BuildingClasses",
      "referencedColumn": "Type",
      "onUpdate": "NO ACTION",
      "onDelete": "NO ACTION"
    },
    {
      "column": "RequiredStateReligion",
      "referencedTable": "Religions",
      "referencedColumn": "Type",
      "onUpdate": "NO ACTION",
      "onDelete": "NO ACTION"
    },
    {
      "column": "RequiredReligion",
      "referencedTable": "Religions",
      "referencedColumn": "Type",
      "onUpdate": "NO ACTION",
      "onDelete": "NO ACTION"
    },
    {
      "column": "ObsoleteTech",
      "referencedTable": "Technologies",
      "referencedColumn": "Type",
      "onUpdate": "NO ACTION",
      "onDelete": "NO ACTION"
    },
    {
      "column": "PrereqTech",
      "referencedTable": "Technologies",
      "referencedColumn": "Type",
      "onUpdate": "NO ACTION",
      "onDelete": "NO ACTION"
    },
    {
      "column": "UnitClassRequired",
      "referencedTable": "UnitClasses",
      "referencedColumn": "Type",
      "onUpdate": "NO ACTION",
      "onDelete": "NO ACTION"
    },
    {
      "column": "RequiredIdeology",
      "referencedTable": "PolicyBranchTypes",
      "referencedColumn": "Type",
      "onUpdate": "NO ACTION",
      "onDelete": "NO ACTION"
    },
    {
      "column": "RequiredPolicy",
      "referencedTable": "Policies",
      "referencedColumn": "Type",
      "onUpdate": "NO ACTION",
      "onDelete": "NO ACTION"
    },
    {
      "column": "ImprovementAnywhereRequired",
      "referencedTable": "Improvements",
      "referencedColumn": "Type",
      "onUpdate": "NO ACTION",
      "onDelete": "NO ACTION"
    },
    {
      "column": "ObsoleteEra",
      "referencedTable": "Eras",
      "referencedColumn": "Type",
      "onUpdate": "NO ACTION",
      "onDelete": "NO ACTION"
    },
    {
      "column": "RequiredEra",
      "referencedTable": "Eras",
      "referencedColumn": "Type",
      "onUpdate": "NO ACTION",
      "onDelete": "NO ACTION"
    },
    {
      "column": "RequiredCiv",
      "referencedTable": "Civilizations",
      "referencedColumn": "Type",
      "onUpdate": "NO ACTION",
      "onDelete": "NO ACTION"
    },
    {
      "column": "Effect",
      "referencedTable": "Language_en_US",
      "referencedColumn": "Tag",
      "onUpdate": "NO ACTION",
      "onDelete": "NO ACTION"
    },
    {
      "column": "Help",
      "referencedTable": "Language_en_US",
      "referencedColumn": "Tag",
      "onUpdate": "NO ACTION",
      "onDelete": "NO ACTION"
    },
    {
      "column": "Description",
      "referencedTable": "Language_en_US",
      "referencedColumn": "Tag",
      "onUpdate": "NO ACTION",
      "onDelete": "NO ACTION"
    },
    {
      "column": "EventClass",
      "referencedTable": "EventClassTypes",
      "referencedColumn": "Type",
      "onUpdate": "NO ACTION",
      "onDelete": "NO ACTION"
    }
  ],
  "indexes": [
    {
      "name": "sqlite_autoindex_Events_1",
      "unique": true,
      "partial": false
    }
  ],
  "createStatement": "CREATE TABLE Events ('ID' integer primary key , 'Type' text  not null unique , 'EventClass' text , 'Description' text , 'Help' text , 'Effect' text , 'EventArt' text , 'EventAudio' text , 'RandomChance' integer default 0 , 'RandomChanceDelta' integer default 0 , 'IsOneShot' boolean default 0 , 'Global' boolean default 0 , 'EraScaling' boolean default 0 , 'EventCooldown' integer default 30 , 'NumChoices' integer default 1 , 'IgnoresGlobalCooldown' boolean default 0 , 'MinimumNationalPopulation' integer default 0 , 'MinimumNumberCities' integer default 0 , 'RequiredCiv' text , 'RequiredEra' text , 'HasMetAMajorCiv' boolean default 0 , 'InDebt' boolean default 0 , 'LosingMoney' boolean default 0 , 'MinimumNumCoastalCities' integer default 0 , 'LessThanMaximumTradeRoutes' boolean default 0 , 'IsUnhappy' boolean default 0 , 'IsSuperUnhappy' boolean default 0 , 'ObsoleteEra' text , 'ImprovementAnywhereRequired' text , 'RequiredPolicy' text , 'RequiredIdeology' text , 'UnitClassRequired' text , 'PrereqTech' text , 'ObsoleteTech' text , 'RequiresPantheon' boolean default 0 , 'RequiredReligion' text , 'RequiredStateReligion' text , 'RequiresAnyStateReligion' boolean default 0 , 'RequiredAnywhereBuildingClass' text , 'RequiredNowhereBuildingClass' text , 'RequiresHolyCity' boolean default 0 , 'RequiresIdeology' boolean default 0 , 'RequiresWar' boolean default 0 , 'RequiresWarMinor' boolean default 0 , 'IsVassalOfSomeone' boolean default 0 , 'IsMasterOfSomeone' boolean default 0 , foreign key (EventClass) references EventClassTypes(Type), foreign key (Description) references Language_en_US(Tag), foreign key (Help) references Language_en_US(Tag), foreign key (Effect) references Language_en_US(Tag), foreign key (RequiredCiv) references Civilizations(Type), foreign key (RequiredEra) references Eras(Type), foreign key (ObsoleteEra) references Eras(Type), foreign key (ImprovementAnywhereRequired) references Improvements(Type), foreign key (RequiredPolicy) references Policies(Type), foreign key (RequiredIdeology) references PolicyBranchTypes(Type), foreign key (UnitClassRequired) references UnitClasses(Type), foreign key (PrereqTech) references Technologies(Type), foreign key (ObsoleteTech) references Technologies(Type), foreign key (RequiredReligion) references Religions(Type), foreign key (RequiredStateReligion) references Religions(Type), foreign key (RequiredAnywhereBuildingClass) references BuildingClasses(Type), foreign key (RequiredNowhereBuildingClass) references BuildingClasses(Type))",
  "metadata": {
    "exportDate": "2025-09-01T02:32:23.197Z"
  }
}