{
  "tableName": "LeagueProjectRewards",
  "rowCount": 9,
  "columns": [
    {
      "name": "ID",
      "type": "INTEGER",
      "notNull": false,
      "defaultValue": null,
      "primaryKey": true,
      "position": 0
    },
    {
      "name": "Type",
      "type": "TEXT",
      "notNull": true,
      "defaultValue": null,
      "primaryKey": false,
      "position": 1
    },
    {
      "name": "Description",
      "type": "TEXT",
      "notNull": false,
      "defaultValue": "NULL",
      "primaryKey": false,
      "position": 2
    },
    {
      "name": "Help",
      "type": "TEXT",
      "notNull": false,
      "defaultValue": "NULL",
      "primaryKey": false,
      "position": 3
    },
    {
      "name": "Building",
      "type": "TEXT",
      "notNull": false,
      "defaultValue": "NULL",
      "primaryKey": false,
      "position": 4
    },
    {
      "name": "Happiness",
      "type": "INTEGER",
      "notNull": false,
      "defaultValue": "0",
      "primaryKey": false,
      "position": 5
    },
    {
      "name": "FreeSocialPolicies",
      "type": "INTEGER",
      "notNull": false,
      "defaultValue": "0",
      "primaryKey": false,
      "position": 6
    },
    {
      "name": "CultureBonusTurns",
      "type": "INTEGER",
      "notNull": false,
      "defaultValue": "0",
      "primaryKey": false,
      "position": 7
    },
    {
      "name": "TourismBonusTurns",
      "type": "INTEGER",
      "notNull": false,
      "defaultValue": "0",
      "primaryKey": false,
      "position": 8
    },
    {
      "name": "GoldenAgePoints",
      "type": "INTEGER",
      "notNull": false,
      "defaultValue": "0",
      "primaryKey": false,
      "position": 9
    },
    {
      "name": "CityStateInfluenceBoost",
      "type": "INTEGER",
      "notNull": false,
      "defaultValue": "0",
      "primaryKey": false,
      "position": 10
    },
    {
      "name": "BaseBeakersTurnsToCount",
      "type": "INTEGER",
      "notNull": false,
      "defaultValue": "0",
      "primaryKey": false,
      "position": 11
    },
    {
      "name": "FreeUnitClass",
      "type": "TEXT",
      "notNull": false,
      "defaultValue": "NULL",
      "primaryKey": false,
      "position": 12
    },
    {
      "name": "AttackBonusTurns",
      "type": "integer",
      "notNull": false,
      "defaultValue": "0",
      "primaryKey": false,
      "position": 13,
      "constraints": "DEFAULT 0",
      "isPrimaryKey": false,
      "isNotNull": false,
      "isUnique": false
    },
    {
      "name": "BaseFreeUnits",
      "type": "integer",
      "notNull": false,
      "defaultValue": "0",
      "primaryKey": false,
      "position": 14,
      "constraints": "DEFAULT 0",
      "isPrimaryKey": false,
      "isNotNull": false,
      "isUnique": false
    },
    {
      "name": "GetNumFreeGreatPeople",
      "type": "integer",
      "notNull": false,
      "defaultValue": "0",
      "primaryKey": false,
      "position": 15,
      "constraints": "DEFAULT 0",
      "isPrimaryKey": false,
      "isNotNull": false,
      "isUnique": false
    }
  ],
  "primaryKeys": [
    "ID"
  ],
  "foreignKeys": [
    {
      "column": "FreeUnitClass",
      "referencedTable": "UnitClasses",
      "referencedColumn": "Type",
      "onUpdate": "NO ACTION",
      "onDelete": "NO ACTION"
    },
    {
      "column": "Building",
      "referencedTable": "Buildings",
      "referencedColumn": "Type",
      "onUpdate": "NO ACTION",
      "onDelete": "NO ACTION"
    },
    {
      "column": "Help",
      "referencedTable": "Language_en_US",
      "referencedColumn": "Tag",
      "onUpdate": "NO ACTION",
      "onDelete": "NO ACTION"
    },
    {
      "column": "Description",
      "referencedTable": "Language_en_US",
      "referencedColumn": "Tag",
      "onUpdate": "NO ACTION",
      "onDelete": "NO ACTION"
    }
  ],
  "indexes": [
    {
      "name": "sqlite_autoindex_LeagueProjectRewards_1",
      "unique": true,
      "partial": false
    }
  ],
  "createStatement": "CREATE TABLE LeagueProjectRewards ('ID' integer primary key autoincrement , 'Type' text  not null unique , 'Description' text default NULL , 'Help' text default NULL , 'Building' text default NULL , 'Happiness' integer default 0 , 'FreeSocialPolicies' integer default 0 , 'CultureBonusTurns' integer default 0 , 'TourismBonusTurns' integer default 0 , 'GoldenAgePoints' integer default 0 , 'CityStateInfluenceBoost' integer default 0 , 'BaseBeakersTurnsToCount' integer default 0 , 'FreeUnitClass' text default NULL , AttackBonusTurns integer DEFAULT 0, BaseFreeUnits integer DEFAULT 0, GetNumFreeGreatPeople integer DEFAULT 0, foreign key (Description) references Language_en_US(Tag), foreign key (Help) references Language_en_US(Tag), foreign key (Building) references Buildings(Type), foreign key (FreeUnitClass) references UnitClasses(Type))",
  "metadata": {
    "exportDate": "2025-09-01T02:32:23.257Z"
  }
}