{
  "tableName": "LeagueProjects",
  "rowCount": 3,
  "columns": [
    {
      "name": "ID",
      "type": "INTEGER",
      "notNull": false,
      "defaultValue": null,
      "primaryKey": true,
      "position": 0
    },
    {
      "name": "Type",
      "type": "TEXT",
      "notNull": true,
      "defaultValue": null,
      "primaryKey": false,
      "position": 1
    },
    {
      "name": "Description",
      "type": "TEXT",
      "notNull": false,
      "defaultValue": "NULL",
      "primaryKey": false,
      "position": 2
    },
    {
      "name": "Help",
      "type": "TEXT",
      "notNull": false,
      "defaultValue": "NULL",
      "primaryKey": false,
      "position": 3
    },
    {
      "name": "ProjectSplashImage",
      "type": "TEXT",
      "notNull": false,
      "defaultValue": "NULL",
      "primaryKey": false,
      "position": 4
    },
    {
      "name": "Process",
      "type": "TEXT",
      "notNull": false,
      "defaultValue": "NULL",
      "primaryKey": false,
      "position": 5
    },
    {
      "name": "CostPerPlayer",
      "type": "INTEGER",
      "notNull": false,
      "defaultValue": "0",
      "primaryKey": false,
      "position": 6
    },
    {
      "name": "RewardTier1",
      "type": "TEXT",
      "notNull": false,
      "defaultValue": "NULL",
      "primaryKey": false,
      "position": 7
    },
    {
      "name": "RewardTier2",
      "type": "TEXT",
      "notNull": false,
      "defaultValue": "NULL",
      "primaryKey": false,
      "position": 8
    },
    {
      "name": "RewardTier3",
      "type": "TEXT",
      "notNull": false,
      "defaultValue": "NULL",
      "primaryKey": false,
      "position": 9
    },
    {
      "name": "PortraitIndex",
      "type": "INTEGER",
      "notNull": false,
      "defaultValue": "0",
      "primaryKey": false,
      "position": 10
    },
    {
      "name": "IconAtlas",
      "type": "TEXT",
      "notNull": false,
      "defaultValue": "NULL",
      "primaryKey": false,
      "position": 11
    }
  ],
  "primaryKeys": [
    "ID"
  ],
  "foreignKeys": [
    {
      "column": "IconAtlas",
      "referencedTable": "IconTextureAtlases",
      "referencedColumn": "Atlas",
      "onUpdate": "NO ACTION",
      "onDelete": "NO ACTION"
    },
    {
      "column": "RewardTier3",
      "referencedTable": "LeagueProjectRewards",
      "referencedColumn": "Type",
      "onUpdate": "NO ACTION",
      "onDelete": "NO ACTION"
    },
    {
      "column": "RewardTier2",
      "referencedTable": "LeagueProjectRewards",
      "referencedColumn": "Type",
      "onUpdate": "NO ACTION",
      "onDelete": "NO ACTION"
    },
    {
      "column": "RewardTier1",
      "referencedTable": "LeagueProjectRewards",
      "referencedColumn": "Type",
      "onUpdate": "NO ACTION",
      "onDelete": "NO ACTION"
    },
    {
      "column": "Process",
      "referencedTable": "Processes",
      "referencedColumn": "Type",
      "onUpdate": "NO ACTION",
      "onDelete": "NO ACTION"
    },
    {
      "column": "Help",
      "referencedTable": "Language_en_US",
      "referencedColumn": "Tag",
      "onUpdate": "NO ACTION",
      "onDelete": "NO ACTION"
    },
    {
      "column": "Description",
      "referencedTable": "Language_en_US",
      "referencedColumn": "Tag",
      "onUpdate": "NO ACTION",
      "onDelete": "NO ACTION"
    }
  ],
  "indexes": [
    {
      "name": "sqlite_autoindex_LeagueProjects_1",
      "unique": true,
      "partial": false
    }
  ],
  "createStatement": "CREATE TABLE LeagueProjects ('ID' integer primary key autoincrement , 'Type' text  not null unique , 'Description' text default NULL , 'Help' text default NULL , 'ProjectSplashImage' text default NULL , 'Process' text default NULL , 'CostPerPlayer' integer default 0 , 'RewardTier1' text default NULL , 'RewardTier2' text default NULL , 'RewardTier3' text default NULL , 'PortraitIndex' integer default 0 , 'IconAtlas' text default NULL , foreign key (Description) references Language_en_US(Tag), foreign key (Help) references Language_en_US(Tag), foreign key (Process) references Processes(Type), foreign key (RewardTier1) references LeagueProjectRewards(Type), foreign key (RewardTier2) references LeagueProjectRewards(Type), foreign key (RewardTier3) references LeagueProjectRewards(Type), foreign key (IconAtlas) references IconTextureAtlases(Atlas))",
  "metadata": {
    "exportDate": "2025-09-01T02:32:23.258Z"
  }
}