{
  "tableName": "MinorCivilizations",
  "rowCount": 58,
  "columns": [
    {
      "name": "ID",
      "type": "INTEGER",
      "notNull": false,
      "defaultValue": null,
      "primaryKey": true,
      "position": 0
    },
    {
      "name": "Type",
      "type": "TEXT",
      "notNull": true,
      "defaultValue": null,
      "primaryKey": false,
      "position": 1
    },
    {
      "name": "Description",
      "type": "TEXT",
      "notNull": false,
      "defaultValue": null,
      "primaryKey": false,
      "position": 2
    },
    {
      "name": "Civilopedia",
      "type": "TEXT",
      "notNull": false,
      "defaultValue": null,
      "primaryKey": false,
      "position": 3
    },
    {
      "name": "ShortDescription",
      "type": "TEXT",
      "notNull": false,
      "defaultValue": null,
      "primaryKey": false,
      "position": 4
    },
    {
      "name": "Adjective",
      "type": "TEXT",
      "notNull": false,
      "defaultValue": null,
      "primaryKey": false,
      "position": 5
    },
    {
      "name": "ArtDefineTag",
      "type": "TEXT",
      "notNull": false,
      "defaultValue": null,
      "primaryKey": false,
      "position": 6
    },
    {
      "name": "DefaultPlayerColor",
      "type": "TEXT",
      "notNull": false,
      "defaultValue": "NULL",
      "primaryKey": false,
      "position": 7
    },
    {
      "name": "ArtStyleType",
      "type": "TEXT",
      "notNull": false,
      "defaultValue": "NULL",
      "primaryKey": false,
      "position": 8
    },
    {
      "name": "ArtStyleSuffix",
      "type": "TEXT",
      "notNull": false,
      "defaultValue": "NULL",
      "primaryKey": false,
      "position": 9
    },
    {
      "name": "ArtStylePrefix",
      "type": "TEXT",
      "notNull": false,
      "defaultValue": "NULL",
      "primaryKey": false,
      "position": 10
    },
    {
      "name": "MinorCivTrait",
      "type": "TEXT",
      "notNull": true,
      "defaultValue": null,
      "primaryKey": false,
      "position": 11
    },
    {
      "name": "Playable",
      "type": "boolean",
      "notNull": false,
      "defaultValue": "1",
      "primaryKey": false,
      "position": 12,
      "constraints": "DEFAULT 1",
      "isPrimaryKey": false,
      "isNotNull": false,
      "isUnique": false
    },
    {
      "name": "FixedPersonality",
      "type": "text",
      "notNull": false,
      "defaultValue": null,
      "primaryKey": false,
      "position": 13,
      "constraints": "REFERENCES MinorCivPersonalityTypes (Type)",
      "isPrimaryKey": false,
      "isNotNull": false,
      "isUnique": false
    },
    {
      "name": "BullyUnitClass",
      "type": "text",
      "notNull": false,
      "defaultValue": "'UNITCLASS_WORKER'",
      "primaryKey": false,
      "position": 14,
      "constraints": "REFERENCES UnitClasses (Type) DEFAULT 'UNITCLASS_WORKER'",
      "isPrimaryKey": false,
      "isNotNull": false,
      "isUnique": false
    }
  ],
  "primaryKeys": [
    "ID"
  ],
  "foreignKeys": [
    {
      "column": "MinorCivTrait",
      "referencedTable": "MinorCivTraits",
      "referencedColumn": "Type",
      "onUpdate": "NO ACTION",
      "onDelete": "NO ACTION"
    },
    {
      "column": "Adjective",
      "referencedTable": "Language_en_US",
      "referencedColumn": "Tag",
      "onUpdate": "NO ACTION",
      "onDelete": "NO ACTION"
    },
    {
      "column": "ShortDescription",
      "referencedTable": "Language_en_US",
      "referencedColumn": "Tag",
      "onUpdate": "NO ACTION",
      "onDelete": "NO ACTION"
    },
    {
      "column": "Civilopedia",
      "referencedTable": "Language_en_US",
      "referencedColumn": "Tag",
      "onUpdate": "NO ACTION",
      "onDelete": "NO ACTION"
    },
    {
      "column": "Description",
      "referencedTable": "Language_en_US",
      "referencedColumn": "Tag",
      "onUpdate": "NO ACTION",
      "onDelete": "NO ACTION"
    },
    {
      "column": "BullyUnitClass",
      "referencedTable": "UnitClasses",
      "referencedColumn": "Type",
      "onUpdate": "NO ACTION",
      "onDelete": "NO ACTION"
    },
    {
      "column": "FixedPersonality",
      "referencedTable": "MinorCivPersonalityTypes",
      "referencedColumn": "Type",
      "onUpdate": "NO ACTION",
      "onDelete": "NO ACTION"
    }
  ],
  "indexes": [
    {
      "name": "sqlite_autoindex_MinorCivilizations_1",
      "unique": true,
      "partial": false
    }
  ],
  "createStatement": "CREATE TABLE MinorCivilizations ('ID' integer primary key autoincrement , 'Type' text  not null unique , 'Description' text , 'Civilopedia' text , 'ShortDescription' text , 'Adjective' text , 'ArtDefineTag' text , 'DefaultPlayerColor' text default NULL , 'ArtStyleType' text default NULL , 'ArtStyleSuffix' text default NULL , 'ArtStylePrefix' text default NULL , 'MinorCivTrait' text  not null , Playable boolean DEFAULT 1, FixedPersonality text REFERENCES MinorCivPersonalityTypes (Type), BullyUnitClass text REFERENCES UnitClasses (Type) DEFAULT 'UNITCLASS_WORKER', foreign key (Description) references Language_en_US(Tag), foreign key (Civilopedia) references Language_en_US(Tag), foreign key (ShortDescription) references Language_en_US(Tag), foreign key (Adjective) references Language_en_US(Tag), foreign key (MinorCivTrait) references MinorCivTraits(Type))",
  "metadata": {
    "exportDate": "2025-09-01T02:32:23.274Z"
  }
}