{
  "tableName": "SpyPassiveBonusesDiplomat",
  "rowCount": 0,
  "columns": [
    {
      "name": "ID",
      "type": "INTEGER",
      "notNull": false,
      "defaultValue": null,
      "primaryKey": true,
      "position": 0
    },
    {
      "name": "Type",
      "type": "TEXT",
      "notNull": true,
      "defaultValue": null,
      "primaryKey": false,
      "position": 1
    },
    {
      "name": "Description",
      "type": "TEXT",
      "notNull": false,
      "defaultValue": null,
      "primaryKey": false,
      "position": 2
    },
    {
      "name": "Help",
      "type": "TEXT",
      "notNull": false,
      "defaultValue": null,
      "primaryKey": false,
      "position": 3
    },
    {
      "name": "NetworkPointsNeeded",
      "type": "INTEGER",
      "notNull": true,
      "defaultValue": null,
      "primaryKey": false,
      "position": 4
    },
    {
      "name": "NetworkPointsScaling",
      "type": "boolean",
      "notNull": false,
      "defaultValue": "0",
      "primaryKey": false,
      "position": 5
    },
    {
      "name": "TradeRouteGoldBonus",
      "type": "INTEGER",
      "notNull": false,
      "defaultValue": "0",
      "primaryKey": false,
      "position": 6
    },
    {
      "name": "ReceiveIntrigues",
      "type": "boolean",
      "notNull": false,
      "defaultValue": "0",
      "primaryKey": false,
      "position": 7
    },
    {
      "name": "RevealTechTree",
      "type": "boolean",
      "notNull": false,
      "defaultValue": "0",
      "primaryKey": false,
      "position": 8
    },
    {
      "name": "RevealPolicyTree",
      "type": "boolean",
      "notNull": false,
      "defaultValue": "0",
      "primaryKey": false,
      "position": 9
    },
    {
      "name": "RevealMilitaryUnitCount",
      "type": "boolean",
      "notNull": false,
      "defaultValue": "0",
      "primaryKey": false,
      "position": 10
    },
    {
      "name": "RevealTradeDeals",
      "type": "boolean",
      "notNull": false,
      "defaultValue": "0",
      "primaryKey": false,
      "position": 11
    },
    {
      "name": "RevealTrueApproaches",
      "type": "boolean",
      "notNull": false,
      "defaultValue": "0",
      "primaryKey": false,
      "position": 12
    },
    {
      "name": "VoteTradePercent",
      "type": "INTEGER",
      "notNull": false,
      "defaultValue": "0",
      "primaryKey": false,
      "position": 13
    }
  ],
  "primaryKeys": [
    "ID"
  ],
  "foreignKeys": [
    {
      "column": "Help",
      "referencedTable": "Language_en_US",
      "referencedColumn": "Tag",
      "onUpdate": "NO ACTION",
      "onDelete": "NO ACTION"
    },
    {
      "column": "Description",
      "referencedTable": "Language_en_US",
      "referencedColumn": "Tag",
      "onUpdate": "NO ACTION",
      "onDelete": "NO ACTION"
    }
  ],
  "indexes": [
    {
      "name": "sqlite_autoindex_SpyPassiveBonusesDiplomat_2",
      "unique": true,
      "partial": false
    },
    {
      "name": "sqlite_autoindex_SpyPassiveBonusesDiplomat_1",
      "unique": true,
      "partial": false
    }
  ],
  "createStatement": "CREATE TABLE SpyPassiveBonusesDiplomat ('ID' integer primary key , 'Type' text  not null unique , 'Description' text , 'Help' text , 'NetworkPointsNeeded' integer  not null unique , 'NetworkPointsScaling' boolean default 0 , 'TradeRouteGoldBonus' integer default 0 , 'ReceiveIntrigues' boolean default 0 , 'RevealTechTree' boolean default 0 , 'RevealPolicyTree' boolean default 0 , 'RevealMilitaryUnitCount' boolean default 0 , 'RevealTradeDeals' boolean default 0 , 'RevealTrueApproaches' boolean default 0 , 'VoteTradePercent' integer default 0 , foreign key (Description) references Language_en_US(Tag), foreign key (Help) references Language_en_US(Tag))",
  "metadata": {
    "exportDate": "2025-09-01T02:32:23.404Z"
  }
}