{
  "tableName": "Technologies",
  "rowCount": 81,
  "columns": [
    {
      "name": "ID",
      "type": "INTEGER",
      "notNull": false,
      "defaultValue": null,
      "primaryKey": true,
      "position": 0
    },
    {
      "name": "Type",
      "type": "TEXT",
      "notNull": true,
      "defaultValue": null,
      "primaryKey": false,
      "position": 1
    },
    {
      "name": "Description",
      "type": "TEXT",
      "notNull": false,
      "defaultValue": "NULL",
      "primaryKey": false,
      "position": 2
    },
    {
      "name": "Civilopedia",
      "type": "TEXT",
      "notNull": false,
      "defaultValue": "NULL",
      "primaryKey": false,
      "position": 3
    },
    {
      "name": "Help",
      "type": "TEXT",
      "notNull": false,
      "defaultValue": "NULL",
      "primaryKey": false,
      "position": 4
    },
    {
      "name": "AIWeight",
      "type": "INTEGER",
      "notNull": false,
      "defaultValue": "0",
      "primaryKey": false,
      "position": 5
    },
    {
      "name": "AITradeModifier",
      "type": "INTEGER",
      "notNull": false,
      "defaultValue": "0",
      "primaryKey": false,
      "position": 6
    },
    {
      "name": "Cost",
      "type": "INTEGER",
      "notNull": false,
      "defaultValue": "0",
      "primaryKey": false,
      "position": 7
    },
    {
      "name": "AdvancedStartCost",
      "type": "INTEGER",
      "notNull": false,
      "defaultValue": "'-1'",
      "primaryKey": false,
      "position": 8
    },
    {
      "name": "Era",
      "type": "TEXT",
      "notNull": false,
      "defaultValue": "NULL",
      "primaryKey": false,
      "position": 9
    },
    {
      "name": "FirstFreeUnitClass",
      "type": "TEXT",
      "notNull": false,
      "defaultValue": "NULL",
      "primaryKey": false,
      "position": 10
    },
    {
      "name": "FeatureProductionModifier",
      "type": "INTEGER",
      "notNull": false,
      "defaultValue": "0",
      "primaryKey": false,
      "position": 11
    },
    {
      "name": "UnitFortificationModifier",
      "type": "INTEGER",
      "notNull": false,
      "defaultValue": "0",
      "primaryKey": false,
      "position": 12
    },
    {
      "name": "UnitBaseHealModifier",
      "type": "INTEGER",
      "notNull": false,
      "defaultValue": "0",
      "primaryKey": false,
      "position": 13
    },
    {
      "name": "WorkerSpeedModifier",
      "type": "INTEGER",
      "notNull": false,
      "defaultValue": "0",
      "primaryKey": false,
      "position": 14
    },
    {
      "name": "FirstFreeTechs",
      "type": "INTEGER",
      "notNull": false,
      "defaultValue": "0",
      "primaryKey": false,
      "position": 15
    },
    {
      "name": "EmbarkedMoveChange",
      "type": "INTEGER",
      "notNull": false,
      "defaultValue": "0",
      "primaryKey": false,
      "position": 16
    },
    {
      "name": "InternationalTradeRoutesChange",
      "type": "INTEGER",
      "notNull": false,
      "defaultValue": "0",
      "primaryKey": false,
      "position": 17
    },
    {
      "name": "InfluenceSpreadModifier",
      "type": "INTEGER",
      "notNull": false,
      "defaultValue": "0",
      "primaryKey": false,
      "position": 18
    },
    {
      "name": "ExtraVotesPerDiplomat",
      "type": "INTEGER",
      "notNull": false,
      "defaultValue": "0",
      "primaryKey": false,
      "position": 19
    },
    {
      "name": "EndsGame",
      "type": "boolean",
      "notNull": false,
      "defaultValue": "0",
      "primaryKey": false,
      "position": 20
    },
    {
      "name": "AllowsEmbarking",
      "type": "boolean",
      "notNull": false,
      "defaultValue": "0",
      "primaryKey": false,
      "position": 21
    },
    {
      "name": "AllowsDefensiveEmbarking",
      "type": "boolean",
      "notNull": false,
      "defaultValue": "0",
      "primaryKey": false,
      "position": 22
    },
    {
      "name": "EmbarkedAllWaterPassage",
      "type": "boolean",
      "notNull": false,
      "defaultValue": "0",
      "primaryKey": false,
      "position": 23
    },
    {
      "name": "AllowsBarbarianBoats",
      "type": "boolean",
      "notNull": false,
      "defaultValue": "0",
      "primaryKey": false,
      "position": 24
    },
    {
      "name": "Repeat",
      "type": "boolean",
      "notNull": false,
      "defaultValue": "0",
      "primaryKey": false,
      "position": 25
    },
    {
      "name": "Trade",
      "type": "boolean",
      "notNull": false,
      "defaultValue": "0",
      "primaryKey": false,
      "position": 26
    },
    {
      "name": "Disable",
      "type": "boolean",
      "notNull": false,
      "defaultValue": "0",
      "primaryKey": false,
      "position": 27
    },
    {
      "name": "GoodyTech",
      "type": "boolean",
      "notNull": false,
      "defaultValue": "0",
      "primaryKey": false,
      "position": 28
    },
    {
      "name": "ExtraWaterSeeFrom",
      "type": "boolean",
      "notNull": false,
      "defaultValue": "0",
      "primaryKey": false,
      "position": 29
    },
    {
      "name": "MapCentering",
      "type": "boolean",
      "notNull": false,
      "defaultValue": "0",
      "primaryKey": false,
      "position": 30
    },
    {
      "name": "MapVisible",
      "type": "boolean",
      "notNull": false,
      "defaultValue": "0",
      "primaryKey": false,
      "position": 31
    },
    {
      "name": "MapTrading",
      "type": "boolean",
      "notNull": false,
      "defaultValue": "0",
      "primaryKey": false,
      "position": 32
    },
    {
      "name": "TechTrading",
      "type": "boolean",
      "notNull": false,
      "defaultValue": "0",
      "primaryKey": false,
      "position": 33
    },
    {
      "name": "GoldTrading",
      "type": "boolean",
      "notNull": false,
      "defaultValue": "0",
      "primaryKey": false,
      "position": 34
    },
    {
      "name": "AllowEmbassyTradingAllowed",
      "type": "boolean",
      "notNull": false,
      "defaultValue": "0",
      "primaryKey": false,
      "position": 35
    },
    {
      "name": "OpenBordersTradingAllowed",
      "type": "boolean",
      "notNull": false,
      "defaultValue": "0",
      "primaryKey": false,
      "position": 36
    },
    {
      "name": "DefensivePactTradingAllowed",
      "type": "boolean",
      "notNull": false,
      "defaultValue": "0",
      "primaryKey": false,
      "position": 37
    },
    {
      "name": "ResearchAgreementTradingAllowed",
      "type": "boolean",
      "notNull": false,
      "defaultValue": "0",
      "primaryKey": false,
      "position": 38
    },
    {
      "name": "TradeAgreementTradingAllowed",
      "type": "boolean",
      "notNull": false,
      "defaultValue": "0",
      "primaryKey": false,
      "position": 39
    },
    {
      "name": "PermanentAllianceTradingAllowed",
      "type": "boolean",
      "notNull": false,
      "defaultValue": "0",
      "primaryKey": false,
      "position": 40
    },
    {
      "name": "BridgeBuilding",
      "type": "boolean",
      "notNull": false,
      "defaultValue": "0",
      "primaryKey": false,
      "position": 41
    },
    {
      "name": "WaterWork",
      "type": "boolean",
      "notNull": false,
      "defaultValue": "0",
      "primaryKey": false,
      "position": 42
    },
    {
      "name": "TriggersArchaeologicalSites",
      "type": "boolean",
      "notNull": false,
      "defaultValue": "0",
      "primaryKey": false,
      "position": 43
    },
    {
      "name": "AllowsWorldCongress",
      "type": "boolean",
      "notNull": false,
      "defaultValue": "0",
      "primaryKey": false,
      "position": 44
    },
    {
      "name": "GridX",
      "type": "INTEGER",
      "notNull": false,
      "defaultValue": "0",
      "primaryKey": false,
      "position": 45
    },
    {
      "name": "GridY",
      "type": "INTEGER",
      "notNull": false,
      "defaultValue": "0",
      "primaryKey": false,
      "position": 46
    },
    {
      "name": "Quote",
      "type": "TEXT",
      "notNull": false,
      "defaultValue": "NULL",
      "primaryKey": false,
      "position": 47
    },
    {
      "name": "PortraitIndex",
      "type": "INTEGER",
      "notNull": false,
      "defaultValue": "'-1'",
      "primaryKey": false,
      "position": 48
    },
    {
      "name": "ScenarioTechButton",
      "type": "INTEGER",
      "notNull": false,
      "defaultValue": "'-1'",
      "primaryKey": false,
      "position": 49
    },
    {
      "name": "IconAtlas",
      "type": "TEXT",
      "notNull": false,
      "defaultValue": "NULL",
      "primaryKey": false,
      "position": 50
    },
    {
      "name": "AudioIntro",
      "type": "TEXT",
      "notNull": false,
      "defaultValue": "NULL",
      "primaryKey": false,
      "position": 51
    },
    {
      "name": "AudioIntroHeader",
      "type": "TEXT",
      "notNull": false,
      "defaultValue": "NULL",
      "primaryKey": false,
      "position": 52
    },
    {
      "name": "BombardRange",
      "type": "integer",
      "notNull": false,
      "defaultValue": "0",
      "primaryKey": false,
      "position": 53,
      "constraints": "DEFAULT 0",
      "isPrimaryKey": false,
      "isNotNull": false,
      "isUnique": false
    },
    {
      "name": "BombardIndirect",
      "type": "integer",
      "notNull": false,
      "defaultValue": "0",
      "primaryKey": false,
      "position": 54,
      "constraints": "DEFAULT 0",
      "isPrimaryKey": false,
      "isNotNull": false,
      "isUnique": false
    },
    {
      "name": "CityLessEmbarkCost",
      "type": "boolean",
      "notNull": false,
      "defaultValue": "0",
      "primaryKey": false,
      "position": 55,
      "constraints": "DEFAULT 0",
      "isPrimaryKey": false,
      "isNotNull": false,
      "isUnique": false
    },
    {
      "name": "CityNoEmbarkCost",
      "type": "boolean",
      "notNull": false,
      "defaultValue": "0",
      "primaryKey": false,
      "position": 56,
      "constraints": "DEFAULT 0",
      "isPrimaryKey": false,
      "isNotNull": false,
      "isUnique": false
    },
    {
      "name": "Happiness",
      "type": "integer",
      "notNull": false,
      "defaultValue": "0",
      "primaryKey": false,
      "position": 57,
      "constraints": "DEFAULT 0",
      "isPrimaryKey": false,
      "isNotNull": false,
      "isUnique": false
    },
    {
      "name": "CorporationsEnabled",
      "type": "boolean",
      "notNull": false,
      "defaultValue": "0",
      "primaryKey": false,
      "position": 58,
      "constraints": "DEFAULT 0",
      "isPrimaryKey": false,
      "isNotNull": false,
      "isUnique": false
    },
    {
      "name": "VassalageTradingAllowed",
      "type": "boolean",
      "notNull": false,
      "defaultValue": "0",
      "primaryKey": false,
      "position": 59,
      "constraints": "DEFAULT 0",
      "isPrimaryKey": false,
      "isNotNull": false,
      "isUnique": false
    },
    {
      "name": "CityAutomatonWorkersChange",
      "type": "integer",
      "notNull": false,
      "defaultValue": "0",
      "primaryKey": false,
      "position": 60,
      "constraints": "DEFAULT 0",
      "isPrimaryKey": false,
      "isNotNull": false,
      "isUnique": false
    },
    {
      "name": "CityWorkingChange",
      "type": "integer",
      "notNull": false,
      "defaultValue": "0",
      "primaryKey": false,
      "position": 61,
      "constraints": "DEFAULT 0",
      "isPrimaryKey": false,
      "isNotNull": false,
      "isUnique": false
    }
  ],
  "primaryKeys": [
    "ID"
  ],
  "foreignKeys": [
    {
      "column": "IconAtlas",
      "referencedTable": "IconTextureAtlases",
      "referencedColumn": "Atlas",
      "onUpdate": "NO ACTION",
      "onDelete": "NO ACTION"
    },
    {
      "column": "Help",
      "referencedTable": "Language_en_US",
      "referencedColumn": "Tag",
      "onUpdate": "NO ACTION",
      "onDelete": "NO ACTION"
    },
    {
      "column": "Civilopedia",
      "referencedTable": "Language_en_US",
      "referencedColumn": "Tag",
      "onUpdate": "NO ACTION",
      "onDelete": "NO ACTION"
    },
    {
      "column": "Description",
      "referencedTable": "Language_en_US",
      "referencedColumn": "Tag",
      "onUpdate": "NO ACTION",
      "onDelete": "NO ACTION"
    }
  ],
  "indexes": [
    {
      "name": "sqlite_autoindex_Technologies_1",
      "unique": true,
      "partial": false
    }
  ],
  "createStatement": "CREATE TABLE Technologies ('ID' integer primary key autoincrement , 'Type' text  not null unique , 'Description' text default NULL , 'Civilopedia' text default NULL , 'Help' text default NULL , 'AIWeight' integer default 0 , 'AITradeModifier' integer default 0 , 'Cost' integer default 0 , 'AdvancedStartCost' integer default '-1' , 'Era' text default NULL , 'FirstFreeUnitClass' text default NULL , 'FeatureProductionModifier' integer default 0 , 'UnitFortificationModifier' integer default 0 , 'UnitBaseHealModifier' integer default 0 , 'WorkerSpeedModifier' integer default 0 , 'FirstFreeTechs' integer default 0 , 'EmbarkedMoveChange' integer default 0 , 'InternationalTradeRoutesChange' integer default 0 , 'InfluenceSpreadModifier' integer default 0 , 'ExtraVotesPerDiplomat' integer default 0 , 'EndsGame' boolean default 0 , 'AllowsEmbarking' boolean default 0 , 'AllowsDefensiveEmbarking' boolean default 0 , 'EmbarkedAllWaterPassage' boolean default 0 , 'AllowsBarbarianBoats' boolean default 0 , 'Repeat' boolean default 0 , 'Trade' boolean default 0 , 'Disable' boolean default 0 , 'GoodyTech' boolean default 0 , 'ExtraWaterSeeFrom' boolean default 0 , 'MapCentering' boolean default 0 , 'MapVisible' boolean default 0 , 'MapTrading' boolean default 0 , 'TechTrading' boolean default 0 , 'GoldTrading' boolean default 0 , 'AllowEmbassyTradingAllowed' boolean default 0 , 'OpenBordersTradingAllowed' boolean default 0 , 'DefensivePactTradingAllowed' boolean default 0 , 'ResearchAgreementTradingAllowed' boolean default 0 , 'TradeAgreementTradingAllowed' boolean default 0 , 'PermanentAllianceTradingAllowed' boolean default 0 , 'BridgeBuilding' boolean default 0 , 'WaterWork' boolean default 0 , 'TriggersArchaeologicalSites' boolean default 0 , 'AllowsWorldCongress' boolean default 0 , 'GridX' integer default 0 , 'GridY' integer default 0 , 'Quote' text default NULL , 'PortraitIndex' integer default '-1' , 'ScenarioTechButton' integer default '-1' , 'IconAtlas' text default NULL , 'AudioIntro' text default NULL , 'AudioIntroHeader' text default NULL , BombardRange integer DEFAULT 0, BombardIndirect integer DEFAULT 0, CityLessEmbarkCost boolean DEFAULT 0, CityNoEmbarkCost boolean DEFAULT 0, Happiness integer DEFAULT 0, CorporationsEnabled boolean DEFAULT 0, VassalageTradingAllowed boolean DEFAULT 0, CityAutomatonWorkersChange integer DEFAULT 0, CityWorkingChange integer DEFAULT 0, foreign key (Description) references Language_en_US(Tag), foreign key (Civilopedia) references Language_en_US(Tag), foreign key (Help) references Language_en_US(Tag), foreign key (IconAtlas) references IconTextureAtlases(Atlas))",
  "metadata": {
    "exportDate": "2025-09-01T02:32:23.407Z"
  }
}